{
  "$schema": "https://json-schema.org/draft/2020-12/schema",
  "$id": "https://localize-anything.dev/schemas/repair-result.schema.json",
  "title": "Localize Anything Repair Result",
  "type": "object",
  "required": [
    "protocol_version",
    "schema",
    "status",
    "segment_regeneration_plan_path",
    "repair_request_path",
    "summary",
    "results"
  ],
  "properties": {
    "protocol_version": { "const": "0.1" },
    "schema": { "const": "localize-anything-repair-result-v1" },
    "run_id": { "type": ["string", "null"] },
    "status": { "enum": ["ready", "pending", "blocked"] },
    "segment_regeneration_plan_path": { "const": "segment-regeneration-plan.json" },
    "repair_request_path": { "const": "repair-request.json" },
    "generated_segments_path": { "type": ["string", "null"] },
    "summary": {
      "type": "object",
      "required": [
        "result_count",
        "completed_count",
        "pending_provider_or_model_repair_count",
        "pending_human_confirmation_count",
        "pending_review_count"
      ],
      "additionalProperties": { "type": "integer", "minimum": 0 }
    },
    "results": {
      "type": "array",
      "items": {
        "type": "object",
        "required": [
          "repair_id",
          "segment_id",
          "repair_type",
          "repair_status",
          "actor_type",
          "source_hash",
          "previous_target_hash",
          "new_target_hash"
        ],
        "properties": {
          "repair_id": { "type": "string", "minLength": 1 },
          "segment_id": { "type": "string", "minLength": 1 },
          "repair_type": { "type": "string" },
          "repair_reason": { "type": "string" },
          "repair_status": {
            "enum": [
              "completed",
              "pending_provider_or_model_repair",
              "pending_human_confirmation",
              "pending_review",
              "applied",
              "pending_provider",
              "pending_human",
              "blocked",
              "skipped_not_deterministic",
              "failed_qa",
              "not_applicable"
            ]
          },
          "actor_type": { "enum": ["runtime_deterministic", "pending_provider_or_model", "human"] },
          "source_hash": { "type": ["string", "null"] },
          "previous_target_hash": { "type": ["string", "null"] },
          "old_target_hash": { "type": ["string", "null"] },
          "old_target_source": { "type": ["string", "null"] },
          "new_target_hash": { "type": ["string", "null"] },
          "new_target": { "type": ["string", "null"] },
          "deterministic_qa_required": { "type": "boolean" },
          "deterministic_rule_used": { "type": ["string", "null"] },
          "no_patch_reason": { "type": ["string", "null"] },
          "target_artifact_updated": { "type": "boolean" },
          "target_artifact": { "type": ["string", "null"] },
          "qa_result": { "type": "object" }
        },
        "additionalProperties": true
      }
    },
    "limitations": { "type": "array", "items": { "type": "string" } }
  },
  "additionalProperties": true
}
